{
	"contract_version": "history-v1",
	"entry": {
		"id": "mem_history_golden",
		"title": "Use event sourcing for orders",
		"type": "architecture_decision",
		"status": "validated",
		"current_score": 0.73
	},
	"range": {
		"since": null,
		"until": "2026-04-20T00:00:00.000Z",
		"event_count": 5
	},
	"timeline": [
		{
			"day": "2026-01-10",
			"events": [
				{
					"id": "ev-1",
					"occurred_at": "2026-01-10T09:00:00.000Z",
					"actor": "agent:pr-bot",
					"actor_kind": "agent",
					"event_type": "entry_proposed",
					"reason": "initial proposal from PR#42",
					"diff": {
						"status": { "before": null, "after": "quarantine" }
					}
				}
			]
		},
		{
			"day": "2026-01-12",
			"events": [
				{
					"id": "ev-2",
					"occurred_at": "2026-01-12T10:30:00.000Z",
					"actor": "system:promote",
					"actor_kind": "system",
					"event_type": "entry_promoted",
					"reason": "all gates passed",
					"diff": {
						"status": { "before": "quarantine", "after": "validated" },
						"score": { "before": 0.5, "after": 0.73 }
					}
				}
			]
		},
		{
			"day": "2026-02-15",
			"events": [
				{
					"id": "ev-3",
					"occurred_at": "2026-02-15T14:05:00.000Z",
					"actor": "user:alice",
					"actor_kind": "user",
					"event_type": "entry_invalidated",
					"reason": "file refactored",
					"diff": {
						"status": { "before": "validated", "after": "quarantine" }
					}
				},
				{
					"id": "ev-4",
					"occurred_at": "2026-02-15T16:00:00.000Z",
					"actor": "system:revalidation",
					"actor_kind": "system",
					"event_type": "entry_revived",
					"reason": "validator confirmed evidence",
					"diff": {
						"status": { "before": "quarantine", "after": "validated" }
					}
				}
			]
		},
		{
			"day": "2026-04-01",
			"events": [
				{
					"id": "ev-5",
					"occurred_at": "2026-04-01T00:00:00.000Z",
					"actor": "system:ttl",
					"actor_kind": "system",
					"event_type": "entry_stale",
					"reason": "TTL expired",
					"diff": {
						"status": { "before": "validated", "after": "stale" }
					}
				}
			]
		}
	]
}
